gauge_id,gauge_name,country,gauge_lat,gauge_lon,area
camels_13240000,LAKE FORK PAYETTE RIVER AB JUMBO CR NR MCCALL ID,United States of America,44.91361,-115.99722,125.91541349116552
camels_13310700,SF SALMON RIVER NR KRASSEL RANGER STATION ID,United States of America,44.98694,-115.725,852.8098741343956
camels_13313000,JOHNSON CREEK AT YELLOW PINE ID,United States of America,44.96167,-115.5,564.0510967782144
camels_13331500,"MINAM RIVER NEAR MINAM, OR",United States of America,45.61987,-117.72659,617.5956285852459
camels_14020000,"UMATILLA RIVER ABOVE MEACHAM CREEK, NR GIBBON, OR",United States of America,45.71958,-118.32329,342.26264717159603
camels_14096850,"BEAVER CREEK, BLW QUARTZ CR, NR SIMNASHO, OR.",United States of America,44.95873,-121.39423,383.5833415292996
camels_14137000,"SANDY RIVER NEAR MARMOT, OR",United States of America,45.39956,-122.13731,674.8227521904955
camels_14154500,"ROW RIVER ABOVE PITCHER CREEK NEAR, DORENA, OREG",United States of America,43.73596,-122.8734,548.5762943400358
camels_14158500,"MCKENZIE RIVER AT OUTLET OF CLEAR LAKE, OR",United States of America,44.36095,-121.99562,122.80623554344773
camels_14166500,"LONG TOM RIVER NEAR NOTI, OREG.",United States of America,44.04984,-123.42621,237.6581373432156
camels_14182500,"LITTLE NORTH SANTIAM RIVER NEAR MEHAMA, OR",United States of America,44.79151,-122.57897,292.11024084346167
camels_14185000,"SOUTH SANTIAM RIVER BELOW CASCADIA, OR",United States of America,44.39179,-122.49758,448.57703934964434
camels_14185900,"QUARTZVILLE CREEK NEAR CASCADIA, OREG.",United States of America,44.54012,-122.43591,257.82082302775063
camels_14187000,"WILEY CREEK NEAR FOSTER, OR",United States of America,44.37235,-122.62314,137.73517125493382
camels_14216500,"MUDDY CREEK BELOW CLEAR CREEK NEAR COUGAR, WA",United States of America,46.07567,-121.9987,349.1913200575767
camels_14222500,"EAST FORK LEWIS RIVER NEAR HEISSON, WA",United States of America,45.83678,-122.46621,328.4977077641743
camels_14236200,"TILTON RIVER AB BEAR CANYON CREEK NEAR CINEBAR, WA",United States of America,46.59538,-122.45956,363.1718356562213
camels_14301000,"NEHALEM RIVER NEAR FOSS, OR",United States of America,45.704,-123.7554,1740.8406769262162
camels_14305500,"SILETZ RIVER AT SILETZ, OR",United States of America,44.71512,-123.88733,525.3087046885297
camels_14306500,"ALSEA RIVER NEAR TIDEWATER, OR",United States of America,44.38595,-123.83178,859.0839121240878
camels_14308990,"COW CREEK ABV GALESVILLE RES, NR AZALEA, OR.",United States of America,42.82318,-123.12589,171.0653209220521
camels_14309500,"WEST FORK COW CREEK NEAR GLENDALE, OR",United States of America,42.804,-123.61091,225.81482707776487
camels_14316700,"STEAMBOAT CREEK NEAR GLIDE, OR",United States of America,43.34984,-122.72894,587.0147424166797
camels_14325000,"SOUTH FORK COQUILLE RIVER AT POWERS, OR",United States of America,42.8915,-124.07065,444.2084407247387
camels_14400000,"CHETCO RIVER NEAR BROOKINGS, OR",United States of America,42.12344,-124.18731,702.2358086310752
